{
  "schema_version": 1,
  "id": "sample-meeting-record",
  "title": "Sample meeting record evidence ledger",
  "status": "published",
  "record_type": "document",
  "linked_article": "sample-pdf-record",
  "published_at": "2026-07-27T12:15:00-04:00",
  "sensitivity": "public",
  "public_release_confirmed": true,
  "rights_confirmed": true,
  "redactions": [],
  "source_materials": [
    {
      "id": "sample-document",
      "title": "Sample meeting document",
      "url": "/uploads/documents/sample-document.pdf",
      "publisher": "Sample records office",
      "retrieved_at": "2026-07-20T09:00:00-04:00",
      "media_type": "application/pdf",
      "description": "Generated fixture used to verify the document-first public-record workflow."
    }
  ]
}
